{"type":"config","name":"Improve CI total execution time","metricName":"ci_total_s","metricUnit":"s","bestDirection":"lower"}
{"run":1,"commit":"71dcbe8","metric":406.5,"metrics":{"actual_recent_pr_total_s":422,"build_assets_s":65.5,"tests_s":170,"browser_matrix_s":339,"linter_s":60,"static_analysis_s":26.5,"performance_tests_s":63,"job_count":13,"browser_shards":4},"status":"keep","description":"Baseline modeled PR CI critical path from current workflow and recent CI timings","timestamp":1778164125780,"segment":0,"confidence":null,"asi":{"hypothesis":"Establish baseline before small workflow experiments","bottleneck":"browser-tests path dominates: build-assets 65.5s + browser matrix 339s + aggregate ~2s","history_source":"6 recent successful pull_request CI runs via gh"}}
{"run":2,"commit":"manual-","metric":0,"metrics":{"actual_recent_pr_total_s":0,"build_assets_s":0,"tests_s":0,"browser_matrix_s":0,"linter_s":0,"static_analysis_s":0,"performance_tests_s":0,"job_count":0,"browser_shards":0},"status":"crash","description":"Try manual browser test filter matrix balanced from CI logs","timestamp":1778164524894,"segment":0,"confidence":null,"asi":{"hypothesis":"Manual filter matrix can reduce slow browser shard by balancing heavy Browser test classes","error":"autoresearch.sh failed to parse class timings from gh run logs; regex expected escaped backslashes differently","rollback_reason":"benchmark crashed before metric","next_action_hint":"Fix log parser to match `Tests\\Browser\\ClassTest` lines, then retry manual filter matrix"}}
{"run":3,"commit":"5278eb7","metric":355.76,"metrics":{"actual_recent_pr_total_s":422,"build_assets_s":65.5,"tests_s":170,"browser_matrix_s":288.26,"linter_s":60,"static_analysis_s":26.5,"performance_tests_s":63,"job_count":13,"browser_shards":5},"status":"keep","description":"Balance Browser CI matrix with manual class filters over five shards","timestamp":1778164650882,"segment":0,"confidence":null,"asi":{"hypothesis":"Current Pest --shard splits Browser files by count and leaves Transactions alone; manual class groups from CI timings reduce slowest browser shard","observed_effect":"Modeled PR critical path drops 50.74s; browser matrix drops 50.74s with same Browser classes covered exactly once","coverage_guard":"autoresearch.sh parses recent CI Browser class list and fails if manual filters omit a class","tradeoff":"Adds one more browser runner job; wall-clock improves, billed runner minutes may increase slightly"}}
{"run":4,"commit":"acb4b02","metric":326.84,"metrics":{"actual_recent_pr_total_s":422,"build_assets_s":0,"tests_s":170,"browser_matrix_s":324.84,"linter_s":60,"static_analysis_s":26.5,"performance_tests_s":63,"job_count":13,"browser_shards":5},"status":"keep","description":"Let PR browser shards build assets directly and skip separate build-assets job","timestamp":1778164798221,"segment":0,"confidence":2.754495159059474,"asi":{"hypothesis":"On PRs, browser jobs already install PHP and Bun; building assets inside shards removes build-assets dependency from critical path despite adding ~36.6s to each shard","observed_effect":"Modeled PR critical path improves another 28.92s versus manual-shard best because 65.5s build-assets gate is removed","correctness":"PR still builds assets before Browser tests; push/workflow_dispatch still run build-assets job","tradeoff":"More duplicate work across 5 PR browser jobs; faster wall-clock but higher billed minutes"}}
{"run":5,"commit":"e0e4ad3","metric":293.24,"metrics":{"actual_recent_pr_total_s":422,"build_assets_s":0,"tests_s":170,"browser_matrix_s":291.24,"linter_s":60,"static_analysis_s":26.5,"performance_tests_s":63,"job_count":13,"browser_shards":6},"status":"keep","description":"Rebalance Browser matrix across six class-filter shards","timestamp":1778164879859,"segment":0,"confidence":3.623160588611645,"asi":{"hypothesis":"With asset build moved into shards, reducing max Browser class work matters; six balanced class groups lower max test time from ~162s to ~129s","observed_effect":"Modeled PR critical path improves 33.6s over five-shard browser-build setup","coverage_guard":"Same 13 Browser classes covered once by explicit filters","tradeoff":"One additional PR browser job; wall-clock improves, billed runner minutes increase"}}
{"run":6,"commit":"0bb7085","metric":237.03,"metrics":{"actual_recent_pr_total_s":422,"build_assets_s":0,"tests_s":170,"browser_matrix_s":235.03,"linter_s":60,"static_analysis_s":26.5,"performance_tests_s":63,"job_count":13,"browser_shards":6},"status":"keep","description":"Run each Browser filter shard with Pest parallelism across two processes","timestamp":1778165005209,"segment":0,"confidence":5.0437500000000055,"asi":{"hypothesis":"Pest 4 docs recommend --parallel for browser CI; two processes split heavy per-filter Browser tests inside each runner while preserving six filter shards","observed_effect":"Modeled PR critical path improves 56.21s; browser matrix estimate drops to 235.03s","risk":"Browser tests may have hidden shared-state or port contention under parallelism; CI must verify with real MySQL per Paratest process","next_action_hint":"If actual CI flakes, reduce to fewer processes or remove --parallel while keeping six filter shards"}}
{"run":7,"commit":"d8f7c90","metric":234.27,"metrics":{"actual_recent_pr_total_s":422,"build_assets_s":0,"tests_s":170,"browser_matrix_s":232.27,"linter_s":60,"static_analysis_s":26.5,"performance_tests_s":63,"job_count":13,"browser_shards":6},"status":"keep","description":"Increase Browser shard parallelism from two to three processes","timestamp":1778165077121,"segment":0,"confidence":2.9012044133748844,"asi":{"hypothesis":"A third Pest parallel process may reduce the heaviest remaining Browser filter load","observed_effect":"Modeled improvement only 2.76s beyond two processes because max individual browser test durations now dominate","risk":"Higher local contention/flake risk for small gain; actual CI should decide if this holds","next_action_hint":"Try four processes once; if marginal, consider reverting to two or three after real CI data"}}
{"run":8,"commit":"four-pr","metric":234.27,"metrics":{"actual_recent_pr_total_s":422,"build_assets_s":0,"tests_s":170,"browser_matrix_s":232.27,"linter_s":60,"static_analysis_s":26.5,"performance_tests_s":63,"job_count":13,"browser_shards":6},"status":"discard","description":"Try four Browser parallel processes per filter shard","timestamp":1778165166669,"segment":0,"confidence":2.92063761234526,"asi":{"hypothesis":"Four Pest parallel processes might further reduce the heaviest browser shard","rollback_reason":"Modeled primary metric unchanged from three processes; max individual test duration dominates","next_action_hint":"Keep three processes for now; search for graph-level wins or split heavy test methods into separate filter shards if worth the added complexity"}}
{"type":"config","name":"Improve CI total execution time on GitHub Actions","metricName":"github_ci_total_s","metricUnit":"s","bestDirection":"lower"}
{"run":9,"commit":"7927e2d","metric":547,"metrics":{"tests_s":170,"linter_s":61,"static_analysis_s":25,"performance_tests_s":67,"build_assets_s":69,"browser_matrix_s":452,"browser_aggregate_s":2,"browser_shards":4,"job_count":13,"run_id":25493817671},"status":"keep","description":"Baseline actual GitHub PR CI duration from recent successful main workflow","timestamp":1778176205496,"segment":1,"confidence":null,"asi":{"hypothesis":"Establish actual GitHub Actions baseline before safe non-manual-shard experiments","run_id":"25493817671","benchmark_method":"earliest non-skipped PR job start to latest measured PR job completion","constraint":"Do not use manual class filters; future tests must remain included automatically"}}
{"run":10,"commit":"1244895","metric":490,"metrics":{"tests_s":159,"linter_s":58,"static_analysis_s":24,"performance_tests_s":64,"build_assets_s":0,"browser_matrix_s":469,"browser_aggregate_s":3,"browser_shards":4,"job_count":13,"run_id":25512237199},"status":"keep","description":"Measure safe PR asset-build-in-shards workflow on GitHub Actions","timestamp":1778176218000,"segment":1,"confidence":null,"asi":{"hypothesis":"Skipping build-assets on PR and building assets inside browser shards removes dependency gate while keeping Pest's automatic shard coverage","observed_effect":"Actual GitHub PR CI improved 57s vs baseline despite browser matrix itself being slightly slower","run_id":"25512237199","constraint_check":"Uses Pest --shard=${{ matrix.shard }}/4; no manual class filters, so new Browser tests remain included"}}
{"run":11,"commit":"five-au","metric":444,"metrics":{"tests_s":172,"linter_s":62,"static_analysis_s":29,"performance_tests_s":56,"build_assets_s":0,"browser_matrix_s":436,"browser_aggregate_s":3,"browser_shards":5,"job_count":14,"run_id":25512726578},"status":"keep","description":"Use five automatic Pest Browser shards on GitHub CI","timestamp":1778176738398,"segment":1,"confidence":2.239130434782609,"asi":{"hypothesis":"Increasing Pest automatic Browser shards from 4 to 5 should reduce slowest shard without manually assigning tests; future tests remain included","observed_effect":"Actual GitHub PR CI improved 46s over 4-shard asset-in-shards run and 103s over baseline","run_id":"25512726578","constraint_check":"Matrix uses shard [1..5] and --shard=${{ matrix.shard }}/5; no class filters"}}
{"run":12,"commit":"six-aut","metric":854,"metrics":{"tests_s":173,"linter_s":55,"static_analysis_s":25,"performance_tests_s":59,"build_assets_s":0,"browser_matrix_s":833,"browser_aggregate_s":3,"browser_shards":6,"job_count":15,"run_id":25513114376},"status":"discard","description":"Try six automatic Pest Browser shards on GitHub CI","timestamp":1778177631530,"segment":1,"confidence":2,"asi":{"hypothesis":"Increasing automatic Browser shards from 5 to 6 may reduce slowest shard while preserving automatic coverage for future tests","rollback_reason":"Actual GitHub PR CI regressed badly: 854s vs 444s best; browser matrix 833s suggests poor count-based shard distribution or runner variance","next_action_hint":"Use Pest time-based sharding with committed tests/.pest/shards.json instead of manual filters or more count shards","run_id":"25513114376"}}
